File firmware.bin is 8388608 bytes
FLMAP0:    0x03040003
  NR:      3
  FRBA:    0x40
  NC:      1
  FCBA:    0x30
FLMAP1:    0x15100206
  ISL:     0x15
  FPSBA:   0x100
  NM:      2
  FMBA:    0x60
FLMAP2:    0x00210120
  PSL:     0x2101
  FMSBA:   0x200
FLUMAP1:   0x000008df
  Intel ME VSCC Table Length (VTL):        8
  Intel ME VSCC Table Base Address (VTBA): 0x000df0

ME VSCC table:
  JID0:  0x0000471f
    SPI Componend Device ID 1:          0x00
    SPI Componend Device ID 0:          0x47
    SPI Componend Vendor ID:            0x1f
  VSCC0: 0x20152015
    Lower Erase Opcode:                 0x20
    Lower Write Enable on Write Status: 0x06
    Lower Write Status Required:        No
    Lower Write Granularity:            64 bytes
    Lower Block / Sector Erase Size:    4KB
    Upper Erase Opcode:                 0x20
    Upper Write Enable on Write Status: 0x06
    Upper Write Status Required:        No
    Upper Write Granularity:            64 bytes
    Upper Block / Sector Erase Size:    4KB
  JID1:  0x001740ef
    SPI Componend Device ID 1:          0x17
    SPI Componend Device ID 0:          0x40
    SPI Componend Vendor ID:            0xef
  VSCC1: 0x20252025
    Lower Erase Opcode:                 0x20
    Lower Write Enable on Write Status: 0x50
    Lower Write Status Required:        No
    Lower Write Granularity:            64 bytes
    Lower Block / Sector Erase Size:    4KB
    Upper Erase Opcode:                 0x20
    Upper Write Enable on Write Status: 0x50
    Upper Write Status Required:        No
    Upper Write Granularity:            64 bytes
    Upper Block / Sector Erase Size:    4KB
  JID2:  0x001720c2
    SPI Componend Device ID 1:          0x17
    SPI Componend Device ID 0:          0x20
    SPI Componend Vendor ID:            0xc2
  VSCC2: 0x20452045
    Lower Erase Opcode:                 0x20
    Lower Write Enable on Write Status: 0x50
    Lower Write Status Required:        No
    Lower Write Granularity:            64 bytes
    Lower Block / Sector Erase Size:    4KB
    Upper Erase Opcode:                 0x20
    Upper Write Enable on Write Status: 0x50
    Upper Write Status Required:        No
    Upper Write Granularity:            64 bytes
    Upper Block / Sector Erase Size:    4KB
  JID3:  0x0017ba20
    SPI Componend Device ID 1:          0x17
    SPI Componend Device ID 0:          0xba
    SPI Componend Vendor ID:            0x20
  VSCC3: 0x20052005
    Lower Erase Opcode:                 0x20
    Lower Write Enable on Write Status: 0x50
    Lower Write Status Required:        No
    Lower Write Granularity:            64 bytes
    Lower Block / Sector Erase Size:    4KB
    Upper Erase Opcode:                 0x20
    Upper Write Enable on Write Status: 0x50
    Upper Write Status Required:        No
    Upper Write Granularity:            64 bytes
    Upper Block / Sector Erase Size:    4KB

OEM Section:
00: 33 64 31 34 35 66 38 32 31 38 34 62 33 31 37 65
10: 32 33 32 61 63 35 37 63 36 64 30 63 65 36 32 31
20: 0a ff ff ff ff ff ff ff ff ff ff ff ff ff ff ff
30: ff ff ff ff ff ff ff ff ff ff ff ff ff ff ff ff

Found Region Section
FLREG0:    0x00000000
  Flash Region 0 (Flash Descriptor): 00000000 - 00000fff 
FLREG1:    0x07ff018e
  Flash Region 1 (BIOS): 0018e000 - 007fffff 
FLREG2:    0x018d0002
  Flash Region 2 (Intel ME): 00002000 - 0018dfff 
FLREG3:    0x00007fff
  Flash Region 3 (GbE): 00fff000 - 00000fff (unused)
FLREG4:    0x00010001
  Flash Region 4 (Platform Data): 00001000 - 00001fff 

Found Component Section
FLCOMP     0x64900044
  Dual Output Fast Read Support:       supported
  Read ID/Read Status Clock Frequency: 50MHz
  Write/Erase Clock Frequency:         50MHz
  Fast Read Clock Frequency:           50MHz
  Fast Read Support:                   supported
  Read Clock Frequency:                20MHz
  Component 2 Density:                 512KB
  Component 1 Density:                 8MB
FLILL      0x00000000
  Invalid Instruction 3: 0x00
  Invalid Instruction 2: 0x00
  Invalid Instruction 1: 0x00
  Invalid Instruction 0: 0x00
FLPB       0x00000000
  Flash Partition Boundary Address: 0x000000

Found PCH Strap Section
PCHSTRP0:  0x2020d7a2
PCHSTRP1:  0x040001ff
PCHSTRP2:  0x00000000
PCHSTRP3:  0x00000000
PCHSTRP4:  0x00c8e004
PCHSTRP5:  0x00000000
PCHSTRP6:  0x00000000
PCHSTRP7:  0x00000000
PCHSTRP8:  0x00000000
PCHSTRP9:  0x7050058c
PCHSTRP10: 0x00c00000
PCHSTRP11: 0x87000089
PCHSTRP12: 0x00000000
PCHSTRP13: 0x00000000
PCHSTRP14: 0x00000000
PCHSTRP15: 0x0018433e
PCHSTRP16: 0x00000000
PCHSTRP17: 0x00000002

Found Master Section
FLMSTR1:   0x0aff0000 (Host CPU/BIOS)
  Platform Data Region Write Access: disabled
  GbE Region Write Access:           enabled
  Intel ME Region Write Access:      disabled
  Host CPU/BIOS Region Write Access: enabled
  Flash Descriptor Write Access:     disabled
  Platform Data Region Read Access:  enabled
  GbE Region Read Access:            enabled
  Intel ME Region Read Access:       enabled
  Host CPU/BIOS Region Read Access:  enabled
  Flash Descriptor Read Access:      enabled
  Requester ID:                      0x0000

FLMSTR2:   0x0c0d0000 (Intel ME)
  Platform Data Region Write Access: disabled
  GbE Region Write Access:           enabled
  Intel ME Region Write Access:      enabled
  Host CPU/BIOS Region Write Access: disabled
  Flash Descriptor Write Access:     disabled
  Platform Data Region Read Access:  disabled
  GbE Region Read Access:            enabled
  Intel ME Region Read Access:       enabled
  Host CPU/BIOS Region Read Access:  disabled
  Flash Descriptor Read Access:      enabled
  Requester ID:                      0x0000

FLMSTR3:   0xffff0118 (GbE)
  Platform Data Region Write Access: enabled
  GbE Region Write Access:           enabled
  Intel ME Region Write Access:      enabled
  Host CPU/BIOS Region Write Access: enabled
  Flash Descriptor Write Access:     enabled
  Platform Data Region Read Access:  enabled
  GbE Region Read Access:            enabled
  Intel ME Region Read Access:       enabled
  Host CPU/BIOS Region Read Access:  enabled
  Flash Descriptor Read Access:      enabled
  Requester ID:                      0x0118

Found Processor Strap Section
????:      0x00000000
????:      0xffffffff
????:      0xffffffff
????:      0xffffffff
????:      0xffffffff
????:      0xffffffff
????:      0xffffffff
????:      0xffffffff
